{
    "id": "test_warden_bar",
    "label": "Test Warden Bar",
    "vocation": "warden",
    "level": 50,
    "promoted": false,
    "skills": {
        "axe": 13,
        "club": 13,
        "distance": 10,
        "fishing": 10,
        "fist": 10,
        "magicLevel": 40,
        "shielding": 20,
        "sword": 30
    },
    "stats": {
        "lifeLeech": 0,
        "manaLeech": 0,
        "critChance": 5,
        "critDamage": 10
    },
    "equipment": {
        "head": "",
        "chest": "",
        "legs": "",
        "boots": "leather_boots",
        "weapon": "iron_longsword",
        "shield": "arrow",
        "amulet": "",
        "ring": "",
        "backpack": "backpack"
    },
    "strategyId": "warden_support",
    "notes": "FROZEN CI profile for arena balance quartet."
}
